"","x"
"1","They’re on lockdown, have military roving around their vicinity, and the continent where it belongs were declared as the center of pandemic, but look at them!

Meanwhile in the Philippines... "
"2","Makes me wish our country can afford a total lockdown so I can draw all day.

But needing to go out to be able to eat and pay bills despite the risk of getting infected is the sad reality of life in the Philippines."
"3","Hard fact is that the Philippines is too poor to afford a total lockdown. "
"4","Coronavirus lockdown strikes fear among Manila's poor | Philippines News "
"5","Philippines restricts travel in, out of Metro Manila to contain COVID-19 "
"6","The Philippines went from 3 Cases to ZERO to 111 all of a SUDDEN; solution now is to shock the citizenry with a Lockdown and let them reflect on how we stayed at zero and now have a HELL of A PROBLEM in a matter of days "
"7","How does a Metro Manila lockdown control the COVID-19 problem when foreigners can fly into all cities in the Philippines? "
"8","Magandang gabi mga ka-quarantine kamusta kayo? 

It's 30 minutes to the Metro Manila community quarantine (a.ka. lockdown) and I still don't understand how the Philippines will defeat COVID-19."
"9","Almost TWO MONTHS ago we WARNED that TATAY needs to IMPOSE strict TRAVEL Restrictions to MINIMIZE the risk! But NO, the trolls called us cry baby and fearmongers! Now we may need to put whole MANILA on LOCKDOWN! Fools! "
"10","This is how Italians react to a lockdown. A stark contrast to the "
"11","The National Capital Region (NCR) of the Republic of the Philippines is going on lockdown tomorrow in a bid to mitigate the spread of COVID-19. Keeping all the frontliners in the fight against this virus in my prayers. <U+0001F64F><U+0001F3FD>"
"12","i hate my life!!!! send me to the philippines!!!! let me be part of the travel ban lockdown until the 14th!!!! let me be locked in a house with my cousins and my sister as we fight doing the chores!!!!"
"13","I WANNA BE ON LOCKDOWN IN THE PHILIPPINES TRAPPED IN A HOUSE WITH MY SISTER, COUSINS, AND A TATTOO GUN!!!! LET SOMEONE TATTOO AN R ON THE BACK OF MY LEFT SHOULDER!!!!"
"14","Goodluck to the provincial hospitals next week. Lockdown pero nag mass exodus ang mga Pinoy? Classic Philippines <U+0001F44F><U+0001F3FC>"
"15","wait a minute the philippines is on lockdown so that means its basically the purge bitch i will break into my teacher’s house and k word some bitches literally my hit list has purpose"
"16","LATEST: Two new deaths in the Philippines, bringing total to 8. It has been a bad week for the country. Confirmed coronavirus cases spiked from 10 cases as of March 8 to 64 cases as of March 13. Lockdown of Metro Manila begins Monday. Curfew is imposed, too, from 8pm to 5am. "
"17","Large number of Indian students in Philippines stranded and helpless due to lockdown. Desperate to return home before the situation worsens "
"18","Large number of Indian students in Philippines stranded and helpless due to lockdown. Desperate to return home before the situation worsens "
"19","INFO: Community quarantine (or lockdown, not totally) will be imposed in some provinces/areas in the Philippines due to coronavirus disease (COVID-19).  This means that travel in and out in an area is restricted.

Source: Philippine Emergency Alerts "
"20","OMG Philippines Lockdown is hella scary!
Its like the real purge!"
"21","Philippines ask citizens to do preventive measures (stay indoors, lockdown.. Etc)
People: nooo! Dictator ka! We will not bow down to military power! You'll use this as an excuse for martial law! 

<U+0001F47D><U+0001F644><U+0001F47D><U+0001F644><U+0001F47D><U+0001F644><U+0001F47D><U+0001F644><U+0001F47D><U+0001F644><U+0001F47D><U+0001F644><U+0001F47D><U+0001F644><U+0001F47D><U+0001F644>"
"22","Coronavirus lockdown strikes fear among Manila's poor | Philippines News | Al Jazeera "
"23","cry babies of the philippines be like: lockdown na martial law na, may tanke na sa kalsada <U+0001F62D><U+0001F62D> govt betrayed us huhuhu "
"24","Metro Manila in the Philippines is in an effective lockdown Panic buying &amp; evac of visitors occurring 
President Duterte  ordered: ""Community quarantine is hereby imposed in the entire of Metro Manila""
Effective from 15 Mar - 14 Apr "
"25","Philippines situation escalating due to several politicians &amp; senior medical staff all being confirmed as infected with "
"26","Other countries on lockdown:OK
Philippines on Lockdown:Martial Law 
Ha?!Hindi ko kayo ma gets. You guys really want the virus to spread?FYI wala akong paki kay duterte.I want everyone to cooperate to slow the spread of the virus.We have a common enemy.Don’t add to the problem.<U+0001F62B>"
"27","COVID19

 LOCKDOWN AND COMMUNITY QUARANTINE IMPLEMENTED.

OTHER COUNTRIES : THEY FOLLOWED.

PHILIPPINES : NAG RALLY!

OHA! MABUHAY!"
"28","other countries: government declares lockdown, citizens follow.

Philippines:
"
"29","Covid-19 Update.
Infected Count - 64.
<U+0001F637><U+0001F9A0>
"
"30","Manila going on lockdown by 15March to April 14 with Marshal Law, curfew and permit system. troop deployment today. Total number of "
"31","Oh crap. I thought Manila is the only one on lockdown. There's a possibility we'll have lockdowns per region in the Philippines. No in and out of our islands!<U+0001F62D>"
"32","Ugh
Our government's plan is just too incoherent.

We might see a nationwide lockdown in our hands.

"
"33","One in five people in Philippines live in extreme poverty "
"34","One in five people in Philippines live in extreme poverty "
"35","Of ALL countries in ASEAN, and ALL countries in the WORLD, can someone explain why only DUTERTE’s Philippines is forced to first LOCKDOWN it’s CAPITAL of 12 million people before anyone any other city??"
"36","In the Philippines they announced a lockdown due to COVID-19 yet here in Japan they don’t give a shit about it <U+0001F643>"
"37","Damn some people here in the Philippines think that having a lockdown and quarantine with a curfew is already a martial law declaration, sometimes these people make me ashamed to even be filipino at all. If they really want martial law they should go somewhere else. "
"38","People in other country when they lockdown they stay at home and never complaint. 

In the Philippines,

People : Martial law! Mga bobong gobyerno! President bashers nag labasan sa social media And all stupid stuff blaming others.

"
"39","Remember the last time wuhan announced lockdown? Nag alisan mga residents and visitors nila because of fear.

Now it's happening again in manila 

Good thing Philippines are separated island country goodluck sa mga government officials it's time gawin nyo duty nyo sa Philippines."
"40","Philippines pls for your own health don’t compate everything to martial law lmao other countries are in lockdown too. Kalma ng onti "
"41","Other countries: Follows the lockdown
Some other part of the Philippines: “Duterte uses COVID para magkaka martial law” <U+0001F926><U+0001F3FB><U+200D><U+2642><U+FE0F>"
"42","shittttt is the release of animal crossing be delayed in the philippines because of the lockdown in manila?"
"43","If you still won't cooperate and be that know-it-all sige reklamo group of people here in the Philippines, I won't be surprise if mag ma-martial law ang president bc grabe niyo ka samok. LOCKDOWN meaning BAWAL KAYONG LUMBAS GIRL just to avoid further spreading of the disease <U+0001F926><U+200D><U+2640><U+FE0F> "
"44","What's happening in the Philippines now is basically Spider-Man PS4

Devil's Breath = Coronavirus
Mayor Osborn unleashing Sable International in response = Duterte imposing a curfew and lockdown"
"45","And the Philippines is having a lockdown and curfew 

((lowkey segway to martial law imo)) "
"46","Reports that NLEX are packed of people going out of Metro Manila hours before the “lockdown” — so instead of containing the virus, this announcement actually dispersed it throughout Northern Philippines instead. 

How frustrating can this incompetence get!"
"47","We have been told not to travel from both the Gov of Australia and Philippines. A monthlong lockdown in Manila starts tomorrow where all domestic flights are cancelled. 
"
"48","We get you, Italy! Really. But unfortunately, Philippines cannot afford a lockdown. Coz by then, our politicians here will be busy pocketing the nation’s money while Filipinos will die of hunger in their homes. <U+0001F60C>"
"49","I was in the Philippines during the Marco era when a curfew was imposed under martial law but that was only from midnight to 5 a.m. 

It did not apply to us on American military bases at that time.
"
"50","no one should ever wish for a lockdown. there are countries dealing with this pandemic without having to impose a lockdown such as Singapore. imposing a lockdown would be a result of an incompetent government such as what we have here in the Philippines."
"51","TMI: Manila lockdown will start at 12mn later and here I am risking my life on my way to the south of Philippines with few minutes gap to my return flight. Istg if I can’t return safely I’ll curse my Client non-stop. "
"52","Philippines to impose 8pm-5am curfew on non-essential travel around Metro Manila; malls asked to shut department stores, cinemas, except groceries, pharmacies; goal is to restrict movement to make lockdown effective. "
"53","In the Philippines: Unprecedented move threatens livelihoods and health of millions of Metro Manila residents  "
"54","Philippines' Duterte Announces 'Lockdown' of Manila to Fight Coronavirus "
"55","President Duterte announced strict immigration curbs and a halt on domestic land, sea and air travel to and from Manila, in what he called a ""lockdown"" of the capital to arrest the spread of coronavirus.
"
"56","WATCH: Panic buying at a supermarket in Manila, the Philippines, on March 12 as the country goes into lockdown over the coronavirus.
"
"57","Cancelled our flight to the Philippines bc Manila’s gonna be on lockdown due to the corona virus outbreak ://"
"58","Coronavirus lockdown strikes fear among Manila's poor | Philippines - "
"59","Due to the coronavirus, Philippine government announced a Metro Manila Lockdown. We highly suggest that everyone must change flights, refund bookings, or postpone trip. Despite of the crisis happening in the Philippines, we are still continuing our services within Metro Manila. "
"60","Philippines restricts travel in, out of Metro Manila to contain COVID-19:"
"61","Coronavirus lockdown strikes fear among Manila’s poor | Philippines News "
"62","Philippines Cancels Masses in Manila amid Coronavirus Lockdown - Release from Bishops
"
"63","Philippines Cancels Masses in Manila amid Coronavirus Lockdown - Release from Bishops - "
"64","Currently here at the philippines right now for work <U+0001F4B5><U+0001F525> actually tomorrow is my flight to NC but philippines had been lockdown the airports and cancelled all the flights  because if the corona virus<U+0001F62A><U+0001F4A6>
 "
"65","USA: State of emergency
Spain: State of emergency
Hungary: State of emergency
China: Lock down
Denmark: Lockdown
Poland: Lockdown
Italy: Lockdown
France: Close schools
Germany: Close schools 
South Korea: Mass testing
Philippines - KANTOT, Jakol, Pakyu"
"66","Philippines puts capital on lockdown due to coronavirus fears "
"67","Philippines puts capital on lockdown due to coronavirus fears "
"68","The suspension of flight is for domestic only during Metro Manila’s one-month Community Quarantine. 

NAIA will remain open for international flights but passengers must be from and are going to stay in Metro Manila, says Secretary Nograles. "
"69","Italy just reported that deaths in last 24 hours was 1255, up from 250 the day before. Lockdown is the only solution: Saudi, Philippines. Singapore has stopped all cruise ships from docking. After summer fires, this will be his next mistake. Level 4 - do not travel NOW too."
"70","i’m frustrated bc my parents are in the philippines rn and manila is on lockdown; how are they gonna get home? :("
"71","Lockdown in manila means I can't interview developers living in near manila directly. LIVE UPDATES: Metro Manila to be placed on 'lockdown' amid COVID-19 outbreak "
"72","I left the Metro to stay at my hometown. They say family is everything and I cannot afford to be separated from my family during this troubled times. I hear all the nasty rumors about this admin and feel this lockdown thing is very scary. God bless the Philippines."
"73","LATE NIGHT CONVERSATIONS WITH ALDI

So my social life is on hold, not really.

"
"74","Some schools/universities are also closed down. My Mom is currently in the Philippines and is supposed to come home on Tuesday, but the Pres. of the PH put Metro Manila on lockdown and I am so worried for her. She might not come home for months...."
"75","thank god my mom came home safe from the philippines before manila was on lockdown but omfg my mares are giving us a hard time, refusing to see us in fear of the virus"
"76","• Italy  lockdown
• America - lockdown
• China - lockdown
• Iran - lockdown
• Japan - lockdown
• Saudi Arabia - lockdown
• Mongolia  - Lockdown
• Philippines - Lockdown

• Indonesia - dont forget to wash your hand.. ojo lali to le

"
"77","LIVE UPDATES: Metro Manila to be placed on 'lockdown' amid COVID-19 outbreak "
"78","Business as usual sa ofc kahit may lockdown. No changes at all.
No adjustment sa schedule na 1am ang uwian. Cavite - Makati - Cavite.  I have to work to live but I have to risk my life for this <U+0001F603>  <U+0001F3B5> Isn't ironic? <U+0001F3B5> "
"79","Air vistara has also banned Kunal now till the 27th April,  It's okay Man , Just imagine  you are in Philippines and your in lockdown country u can't fly just enjoy at home. <U+0001F60A> "
"80","Air vistara has also banned Kunal now till the 27th April,  It's okay Man , Just imagine  you are in Philippines and your in lockdown country u can't fly just enjoy at home. <U+0001F60A> "
"81","No more slaughter in the streets? 
Philippines President Duterte Orders Lockdown in Manila Amid Coronavirus Pandemic "
"82","62 confirmed cases
5 deaths
Manila lockdown
Schools and universities of selected provinces are suspended from 16th march to 12th April <U+0001F625>

"
"83","Can’t wait for EP4 of "
"84","Philippines' Duterte announces 'lockdown' of Manila to fight coronavirus "
"85","I appreciate the genorousity but how about us? Us? Philippines under state of calamity and lockdown? C’mon! "
"86","Panic in Metro Manila as people try to get in and out of the city on eve of 30-day lockdown starting this weekend. Pres Rodrigo Duterte announced the city-wide quarantine Thursday night to address rising cases of COVID-19 and raised Philippines alert level to Code Red Sub-level 2 "
"87","Setting up lockdown measures in various cities around the Philippines can probably help contain the spread of pathogens. But looking it from another perspective, it can be a trial-run for a Martial Law. "
"88","the way a lockdown is the most effective way to control this pandemic but i know its gonna be hell for the philippines and be used as an advantage by the president... it’s a sad time my friends"
"89","BREAKING: "
"90","Lockdown Countdown. "
"91","So my son is stuck in the Philippines, trying to get home before the lockdown in Manila....I need a drink!
"
"92","It infected hundred thousands of people from different sides of the world. Many countries have announced lockdown already. Including my country, Philippines, that implemented lockdown in the capital region."
"93","So i just realize that if its lockdown here in philippines then delivery would stop meaning animal crossing wont arrive on march 20 im so sad ;((( "
"94","Manila, a city of thirteen million people in the Philippines, has entered a month long community lockdown with all domestic travel and mass gatherings banned.

"
"95","Philippines' Duterte announces 'lockdown' of Manila to fight "
"96","Philippines' Duterte announces 'lockdown' of Manila to fight coronavirus "
"97","As if i don't have enough stress as it is trying to leave the Philippines before it goes into lockdown my bf has said when I get in hanoi he wants me to isolate myself for 7 days so i dont give him n his family the virus :))) hahaha a mean fair enough but how rude"
"98","The Philippines has 50 cases of coronavirus but its President has put the capital of Manila,with its  13million residents, on a lockdown for a month.Trapping some tourists within. <U+0001F62C> damn if you do,damn if you don’t."
"99","My family and I will most likely go to the Philippines in June instead of next month bc of all this coronavirus happening 14 cities are currently on lockdown. At least I can save up more for SMASH and Madfest Melb this time LOL. tix + accom <U+0001F44C>"
"100","Philippines' Duterte announces 'lockdown' of Manila to fight... "
"101","Spain,France, Belgium,Portugal,
Bolivia, Philippines,Ireland: schools all closed

Italy: Lockdown
Norway: Lockdown
China: Lockdown
Denmark: Lockdown

Boris:”Sorry chaps, the economy is more important, some of your family is going to die but keeps washing your hands”"
"102","Philippines' Duterte announces 'lockdown' of Manila to fight coronavirus 

"
"103","Philippines' Duterte announces 'lockdown' of Manila to fight coronavirus "
"104","Some members of the House of Representatives frowned at calls to place Metro Manila under lockdown, amid the rapid rise of "
"105","Anders Corr, Journal of Political Risk: Lockdown is controversial and problematic because people who are infected may flee and infect others throughout the Philippines. "
"106","Philippines restricts travel in, out of Metro Manila to contain "
"107","I wanna buy TOTM sequel but my TOTM album that I ordered end of January still hasn't arrived due to COVID19 and since Manila's on lockdown I feel like it's just gonna get delayed too <U+0001F62D><U+0001F62D><U+0001F62D><U+0001F62D>
 I mean my NeoZone album's delayed too <U+0001F62D>
I truly do hate living in the Philippines"
"108","Philippines: 50 cases, schools r closed. Capital Manila is on lockdown
Ireland: 70 cases, Schools r closed
Bolivia: 3 cases, schools r closed
HongKong: 130 cases, Schools r closed

Not every country have the luxury to fight corona in the exact similar way you idiot.. "
"109","Breaking. 

The Philippines will go into total lockdown for 30 days as of 15 th March. 

All sea, land and airports will be closed. 

Manila is in lockdown too. Unless you work or live in the Capitol there is no entry. 

"
"110","Workers are restive over the lack of guidelines on company lockdowns and paid quarantine periods amid the spread of coronavirus disease COVID-19, according to the Trade Union Congress of the Philippines (TUCP). | "
"111","Philippines President Duterte places the capital region on a lockdown for a month to help contain the outbreak of the coronavirus "
"112","Salute to our police force. PH govt should protect our doctors, nurses, military and police, civilians who are willing to risk their lives to contain the spread of the virus. Those who think lockdown is martial law, you’re insane! "
"113","“Philippine President Rodrigo Duterte announced plans on Thursday (Mar 12) for a sweeping lockdown of the capital's 12 million people, including a halt to domestic travel, in a bid to contain the deadly new coronavirus” "
"114","January 2020 - Wildfire in Australia
February 2020 - Volcanic eruptions, earthquakes, and plane crash
March 2020 - Corona Virus, Bird flu, No graduation.

Ano pa ba ang dadating? Pwede bang irestart yung 2020?

"
"115","COVID-19 is the worst public health crisis in a century. Countries enforce mass closures to stem spread.
After China, Italy, Denmark
Philippines announced lockdown on Metro Manila
&amp; Spain announced lockdown
on 4 cities. Only lockdown slows its spread.
"
"116","Land, domestic air, and domestic sea travel to and from Metro Manila shall be suspended beginning March 15, 2020 until April 14, 2020 subject to the daily review of the inter-agency task force, President Duterte says during his address on "
"117","Philippine authorities on Thursday placed Metro Manila under quarantine, halting travel in and out of the capital region for a month from March 15 until April 14, 2020. "
"118","Philippines restricts travel in, out of Metro Manila to contain "
"119","Omg I was supposed to go to the Philippines on Monday for my cousins wedding but now the whole trip and wedding is cancelled because of corona virus lockdown <U+0001F62D>"
"120","President Duterte orders lockdown of Philippine capital Manila to fight ... "
"121","Philippines President Duterte places the capital region on a lockdown for a month to help contain the outbreak of the coronavirus "
"122","LIVE UPDATES: Metro Manila to be placed on 'lockdown' amid COVID-19 outbreak "
"123","there is a possibility that the economic crisis in 2008 could happen again. China as the most credible market player must do a lockdown, as well as Italy, the Philippines, and even Denmark who have never done this before. many events and activities were eventually suspended"
"124","LATEST BREAKING NEWS! "
"125","India, lockdown entire country, deny incoming foreign traveler. Philippines, lockdown entire country, deny incoming foreign traveler. Saudi, lockdown entire country, deny incoming foreign traveler. Indonesia? “Come here, cheap domestic flight, Yogya is Covid-19 free!”"
"126","BREAKING: Health Secretary Francisco Duque raises the possibility of declaring a localized lockdown on areas with significant number of coronavirus cases "
"127","“For Manila, some say, ‘We don’t want to use that term’...because you’re afraid to call it a lockdown. But it’s a lockdown,” Duterte said.
"
"128","Philippines' Duterte announces 'lockdown' of Manila to fight coronavirus "
"129","Philippines' Duterte announces 'lockdown' of Manila to fight coronavirus "
"130","In the midst of Covid19 pandemic, almost half of the country in the world declares total lockdown, while Philippines would rather choose to loose its people than loosing profits and all if they will declare total lockdown for the country."
"131","Asia Chaos :

"
"132","The dumbest thing I've heard in this pandemic era is from a MAYOR "
"133","Went for my weekly grocery run at 9 AM and this is what I found.

Panic buying in Manila Philippines. We are in lockdown. No one in or out of the capital. "
"134","Confusions arises with regards to PRRD announcement of lockdown, guidelines will tackled today, let us not create panic its only for preventing the disease, let us all cooperate its our own good naman,  we have to understand, I know first time ito to happened in the Philippines."
"135","It’s official the Philippines (mostly Manila) is going under lockdown on the 15th of march till April 12 because of the threat of covid-19"
"136","'Land, domestic air and domestic sea travel to and from Metro "
"137","MEDIA ALERT: As "
"138","I think the Philippines can't be put on a total and complete lockdown because the government is not equipped with everything needed to keep functioning as a country when it happens. I seriously think that we don't have a budget alloted for emergency cases like this one."
"139","Ohh mah gad corona virus got in to the philippines lockdown CRAP stay safe everyone "
"140","Philippines restricts travel in, out of Metro Manila to contain COVID-19 | ABS-CBN News "
"141","Philippines restricts travel in, out of Metro Manila to contain COVID-19 "
"142","Philippines: BREAKING: Duterte Discusses Measures to Combat COVID-19, NCR to Undergo Lockdown "
"143","LIVE UPDATES: Metro Manila placed on lockdown amid COVID-19 outbreak "
"144","Other countries who had lockdown imposed : Obeys, no complaints, knwos its for their own good

Philippines: MARTIAL LAW na! Ginagamit lang na rason ang COVID 

<U+0001F926><U+200D><U+2640><U+FE0F><U+0001F926><U+200D><U+2640><U+FE0F><U+0001F926><U+200D><U+2640><U+FE0F> "
"145","Lockdown in Manila might mean my parents won't even be able to return to Philippines (from Singapore) and leave to come back to the US. Ugh...."
"146","Other countries: Supporting each other to fight against the virus
Philippines: Pagalingan kung “Lockdown” ba o “Quarantine” ang tamang term. Fighting each other. Attacking each other.

Corona Virus <U+0001F9A0>:
Immune System:
Other Countries:"
"147","Lolol y’all can mess around and get cheap flights with everything happening but watch your asses get stuck in a foreign country <U+0001F480>

My dad had to go to the Philippines but now he’s stuck in Manila longer because they’re on lockdown till next month"
"148","So going back now the philippines has a total of 49 cases accdg to Manila Bulletin. Last night, the president implemented a community quarantine, meaning hindi total lockdown so people can still go around the city, but travel in and out MM is prohibited starting 03/15 to 04/14 "
"149","Reuters: ""As of today, the Philippine Mission is in lockdown, and all personnel are instructed to self-quarantine and to seek medical attention should they develop the symptoms...,"" wrote Philippines acting UN Ambassador Kira Azucena in a message seen by Reuters

"
"150","Philippines may impose "
"151","METRO MANILA placed LOCKDOWN due to CORONAVIRUS OUTBREAK. President Rodrigo Duterte will place Metro Manila on lockdown for at least 30 days to contain the spread of the novel coronavirus in the Philippines. Code Red Sublevel 2 Thursday, March 12

"
