"","x"
"663","how to be fcking calm <U+0001F631><U+0001F616> Im not panicking but im nervous and worried <U+0001F614> "
"664","Don't blame the Government.
Do your part as Filipino citizen.

"
"665","Oh no. Can we postpone similar gatherings here in the Philippines? "
"666","Feeling ko talaga may nag leak ( leak talaga, girl?) ng corona virus to capitalize the alarming global threat to carry through martial law kaya pala nag thank you sa China si PRRD during his announcement night 12th of March&amp;did you know i ran out of bread na like omf "
"667","I'll just leave it here.
©
"
"668","I have no words for this shit. "
"669","It's not your fault <U+0001F614>

"
"670","Keepsafe everyone!! Don't forget to pray before we sleep<U+0001F64F><U+0001F64F><U+0001F495> "
"671","Chill and Relax while "
"672","Just in case we forget, There is power in the Name of Jesus. His Name is above every name. 
God is above this crisis! 
"
"673","The role of the national government is to ensure there’s peace and order in its country. Pero every time nagsasalita sila nagtritrigger lang lagi ng panic. Such glaring incompetence. I cannot. Ano ba talaga? "
"674","I hope theres also social media lockdown to those people who are spreading false information or fake news online regarding "
"675","This device show Corona virus in human "
"676","Covid 19 Community Quarantine Question: How will you reconcile the principle of ""There is no crime if there is no law punishing it"" and Article 151 of the RPC when a person violates the resolution order made by the President?
"
"677","After attending an online class for the first time, I realized that it can be more stressful than the traditional classroom setting (especially in terms of connectivity and computer-related problems).  "
"678","The rise of COVID-19 cases from 64 to 98 is very alarming.
We need to follow security and medical protocol instead of spreading fear and promoting panic-buying. Stay healthy, everyone. "
"679","Oh no, 111 cases. Again, do not panic. Follow security and medical SOPs. "
"680","Indeed it hurts. "
"681","blaming the government doesn’t help the situation, instead of panicking, be knowledgeable "
"682","The government should do mass testing as soon as possible <U+0001F630> "
"683","98 to 111.. Very alarming na. <U+0001F61E>
"
"684","Let the government officials do their job.. Wag na masyado magreklamo. "
"685","Newborn baby in London becomes world's youngest corona victim<U+0001F62D><U+0001F62D><U+0001F62D>

"
"686","""It’s not the government at all, I think it’s the people with lack of discipline and cooperation.
And then blame the government?""

sa totoo lang
"
"687","Where can I donate to help in the COVID-19 crisis here in the Philippines?

"
"688","I didn’t realize because of the virus people are becoming more stupid LOL "
"689","""Toilet Rolls"" are still in high demand amind "
"690","Instead of ranting about community quarantine or Lockdown,why don't we just follow of what the President are doing? "
"691","It’s not the government at all, I think it’s the people with lack of discipline and cooperation. <U+0001F612>

And then blame the government?

"
"692","When the government of China ordered to cancel classes/work and advised the people to stay in their respective homes, all the citizens followed, same with SG, HK and Macau. Meanwhile, in the Philippines...

-A thread

"
"693","So people are hoarding a lot of alcohol instead of rice<U+0001F60A><U+0001F60A> "
"694","Do not hoard facemasks and alcohols. Our frontliners are in dire need of those. If the frontliners fail, WE ALL FAIL.

"
"695","ANO BA TALAGA! Everyone is panicking. Jusko! Holy mother of Christ. 
"
"696","“e-numan” n. 1. electronic inuman 2. an alternative to inuman where you and your friends hang out and drink via facetime/skype/messenger video chat "
"697","Dying not virgin anymore amid "
"698","Yes it's definitely not Duterte's fault, yet it's normal that we express our disappointment toward the situation. Especially if the administration could've prioritize preemptive measures againts the virus over economic relationship of China and PH in the first place. "
"699","And to those causing ARTIFICIAL SHORTAGE of medical supplies.. true heart for the nation will reveal at times of trouble like this. <U+0001F60C> 

Superego, where u at? 
"
"700","People should stop complaining and start doing their own part to prevent the spread of ncov. The government has its own action plan and we might as well do our responsibility as a citizen of this country which will also be for the benefit of many. "
"701","The National Govt should take its cue from LGU-Gensan and call this MEtro Manila “community quarantine” or lockdown what it really is: Preventive Suspension (Restriction) on Non-Essential Travels. Para walang disconnect and confusion. "
"702","messy information may lead to disorder 
"
"703","In this case, what you don't know can hurt you. 
"
"704","""Filipinos, it's QUARANTINE not PRISON. It's RESTRICTION not MARTIAL LAW. 

Don't make things worse because of your STUPIDITY, carelessness and spoiled attitude.""

c/o Rafael De Leon
"
"705","when will people get tired of complaining? martial law is way too different from community quarantine lmao yall hate our president this much that you literally forget about the real issue here "
"706","Not to generalize, but some of tagalog people are literally a moron, they blame the government and make stupid and nonsense rants instead of supporting and following its commands and orders, your stupidity can't help solve the problem. wake up people!!! "
"707","yell it, til the government hears it.
"
"708","My heart is shattering because everything is different now because of "
"709","If your first instinct was to buy toilet paper during the "
"710","God's permissible will,
the chains of the demon lengthened.

the plague of pestilence of the Exodus
the pale horse of the Revelation
the suffering of Job retold

Paul's eight chapter to the Romans
The greater good obtained
as a great evil is released

"
"711","COVID spell's backwards 
""DIVOC""
:Me at my room ""what DIVOC is happening!""

"
"712","When the government can't control, contain, or prevent the spread of "
"713","Late afternoon today, there’s a massive exodus of cars going into NLEX tailending at Kamuning... "
"714","The Corona Virus Anthem "
"715","Not talking about infection rate. But the rising death toll in the Philippines means that we are either an unhealthy people with unhealthy lifestyle (inasfar as diet and exercise are concerned) or the health care system is faulty (from medicine, to patient care). "
"716","These rumors about escaped PUIs on the run and suspicions of confirmed "
"717",".. NOW VIRUS PROOF <U+0001F62D><U+0001F62D> "
"718","Guys ask yourselves
 ""ano na ba nagawa nyo ?""
Buying too much alcohol 
Going panic buying? 
We should be responsible to others as well
And Disciplined for now lang naman ito sacrifices lang naman para sa ating  lahat sa kapakanan natin ito
"
"719","The constantly-changing and contradicting messages from multiple government units just underline how our government is unequipped and ill-prepared for life- and infrastructure-threatening situations. "
"720","This breaks my heart. <U+0001F62D>
"
"721","I feel sad for my sister n law &amp; my brother. They tried to buy basic stuff at the grocery, but Manila people were hot headeds and aggresive right now. My brother pick the last stock item, then the 2 guy asked him for a fist fight. Hello! Lets not be barbaric! <U+0001F97A> "
"722","Filipinos just love to complain. In other words, they’re like stupid! "
"723","I feel so pity about these small minded people who called COVID19 alert a martial law! Wtf! "
"724","Let's be aware of the difference between COMMUNITY QUARANTINE and LOCKDOWN. To reduce mass hysteria.

"
"725","To summarize how the government is handling the "
"726","We need to follow for our own protection &amp; to contain the virus infection. We don't want add'l 1k plus Filipinos in the ICU just because of the virus. So please stop blabbering and just report any military or police that will abuse their power. But for now, follow. "
"727","“Stop waiting for the spread of the virus to start protecting yourself. Prevent any risk: stay home, stay safe and EVERYTHING WILL BE ALRIGHT.”
"
"728","""what if earth is doing its cleansing and healing because humans are destroying and threat to its body?""

"
"729","THIS EPIDEMIC WILL END SOON THIS EPIDEMIC WILL END SOON     THIS EPIDEMIC WILL END SOON THIS EPIDEMIC WILL END SOON THIS EPIDEMIC WILL END SOON THIS EPIDEMIC WILL END SOON THIS EPIDEMIC WILL END SOON THIS EPIDEMIC WILL END SOON THIS EPIDEMIC WILL END SOON "
"730","Fellow makatizens, in this current climate, let’s bag our own groceries when the cashier is all alone, just to get the lines moving. It’s not their fault and they’re all overwhelmed as it is.  "
"731","I have never seen Ayala Mall on a Saturday night so empty "
"732","We must be safe. Prayer should be the outbreak.
"
"733","Do not let this Virus cripple humanity!  <U+0001F645>

"
"734","Epidemiological Comparison of Respiratory Viral Infections. 
Comparing Flu vs COVID-19 vs SARS vs MERS.

Incubation time is the period between exposure to an infection and the appearance of the first symptoms. "
"735","My mom called and told her I can't seem to go home this May because we are discouraged to travel dometic/intl until May. But if we insist, you'll need to self quarantine for 2weeks with no pay. 

I gave her this reasons.. now, I realized it shouldn't be about money. "
"736","Our current company operation is 24/7 due to high volume of jobs, and tho we can have 1 day rest– the risk is freaking high. "
"737","When sometimes, we fail to understand because we refuse to understand..... "
"738","Let's stop blaming the government.
Let's start doing our part as citizens of this nation."
"739","The policy is served. The actions of my people are disgusting.
"
"740","28 days with no work.

Company decided to charge it to our SL and VL, kapag kulang na counted as AA.

Sigh. "
"741","**STOP PANIC-BUYING WHILE OTHERS ARE PANIC-DYING.

"
"742","The way i got anxious of everything because of this. This is the worst "
"743","Patulan nyo mga comments ko! Im so bored and out of this world! <U+0001F644> "
"744","greedy people are the real virus in this world "
"745","i swear na stress nakos kabulok sa mga tao ron. follow the advice of DOH and WHO instead of whining. everyone is doing their best already to avoid the problem from getting worse. cooperate with the authorities. ayaw pag hinilas ug sige rag reklamo dira. "
"746","Fashion Week 2020 postponed amid coronavirus spread

"
"747","YOU RUINED EVERYTHINGGGGGGG!

"
"748","so much people getting crazy buying alcohol but few wants to buy soap. "
"749","What if this virus is the solution for China to take over the world in a way that it'll lessen the population and an easy way to kill a president<U+0001F974>?
"
"750","Let us not blame the government for designating the armed forces and uniformed personnel in the "
"751","It is okay to be loud because your opinion does matter but to blame the government all the damn time does NOT help the humanity.
"
"752","WAIT WHAT THE FK confusing pa more!! "
"753","“but if your government or company is slow on the uptake, don't be that person. TAKE RESPONSIBILITY. for all but essential movement, restrict yourself.”
"
"754","Handa na ba kayo Southies? 

Advisory is from the City Government of Muntinlupa's official FB page.

"
"755","Don't panic.
Focus on your health.

"
"756","Filipinos, it's QUARANTINE not PRISON. It's RESTRICTION not MARTIAL LAW. 

Don't make things worse because of your stupidity, carelessness and spoiled attitude. Oh not to mention your political opinions. Your country is my country too. 

"
"757","Our government is a big failure. "
"758","It's not about pro or anti-Duterte anymore, nor thinking of possible Martial Law. It's about whether you are pro-life or anti-life, whether you participate the government's strive to overcome this horrible situation for the betterment of everyone. 
"
"759","I hope the media will be fast enough to report if a member of AFP or PNP gets positive (not praying that it happens of course). 

For badge or no badge, even with masks, everyone is at risk. 

Military action defeats the purpose of social distancing. <U+0001F643> "
"760","Strictly will be implemented on Monday. "
"761","2 alcohol per buyer policy, pero dahil naubusan yung roommate ko, binenta ko sa kanya yung isa kong nabili.
Not for her but for me as well.

If you haven't realized yet that in this situation, the greedy dies first. 

"
"762","so my Lolo has fever... y'all are welcome to my funeral <U+0001F480><U+2728> "
"763","Now we all see how incompetent this government is. Kagulo niyo po. Hays!!! "
"764","LOCKDOWN OR THE PURGE? "
"765","Blaming the Government doesn't help the situation, thus, it only makes the problem even worse. In times of this problem, all we can do is pray, be safe and always cooperate with the government. Di yung kukuda ka pa dyan tas gala ka pa ng gala without proper hygiene. "
"766","The same people who rants about our government's decisions are the same people who cannot even segregate biodegradable from non biodegradables. I KNOW YOUUUU

"
"767","The treatment of "
"768","""Filipinos, it's QUARANTINE not PRISON. It's RESTRICTION not MARTIAL LAW. 

Don't make things worse because of your stupidity, carelessness and spoiled attitude."" 

THIS!

"
"769","wtf! the philippines now has 98 confirmed cases!!!! pls stop already this is getting insane <U+0001F62D>

"
"770","One thing is for sure...
Many students all over the world especially those graduating students will surely be sad because this COVID-19 is stealing momentous event such as graduation and moments with their classmates/batchmates <U+0001F926><U+0001F3FB><U+200D><U+2642><U+FE0F><U+0001F97A><U+0001F622>

"
"771","Can y’all please stop spreading FAKE news! If you have the hearsays about the virus, scrutinize first before publicize. Hindi kayo nakakatulong!!! "
"772","Not pro-Duterte but how can Pinoys still resist the measures being put into place to secure their health? Puro reklamo, ayaw mag-cooperate, then in the end still blames everyone but themselves when things get worse. Only in the Philippines! "
"773","""Filipinos, it's QUARANTINE not PRISON. It's RESTRICTION not MARTIAL LAW. 

Don't make things worse because of your stupidity, carelessness and spoiled attitude."" 

TOTOO!!!! 

"
"774","Corona virus during 5:01am to 7:59pm...

"
"775","Las Piñas City is now on State of Calamity. <U+2639><U+FE0F><U+0001F494>
"
"776","History muna tayo. 

Juan Ponce Enrile survived all of this epedemic and now, still fighting for a pandemic COVID19.

There's still hope. All we need is to pray to God. <U+0001F64F><U+0001F64F><U+0001F64F>
 "
"777","8 of 98.. or 8.16% for the Philippines

Global death at 3.5% <U+0001F614>

"
"778","I am not even on self-quarantine. But reading all the news about the pandemic, this is me now. "
"779","The  number of cases infected of covid is increasing &gt;^&lt; "
"780","Parties here in Siargao are suspended bc of this "
"781","Trying to distract myself amidst the worsening situation in the PH due to Covid-19 by watching movies but marathoning Resident Evil probly ain't the best idea. <U+0001F640> Stay safe &amp; keep the faith everyone! <U+0001F64F><U+0001F4AA>
"
"782","Due to the imposed curfew that begins at 8pm secondary to community quarantine. Mall hours are cutdown till 7pm.

"
"783","Feeling ko if it were not of the publication of Deloitte of their employee positive of the virus, it's still hidden by the government. Hate this government all you want coz deserved!!! "
"784","Last day of domestic flights. I feel sad for those employees who will have to settle with the no work no pay policy. I mean, they have families to feed and bills to pay. <U+0001F636>
"
"785","Don't complain about government motherfuckers we need to unite and follow the rules "
"786","CALL CENTER AGENTS ARE BEING IGNORED, WE ARE NOT IMMORTALS "
"787","We should also consider those people who r working in a BPO comp. most of them are restless and theyre working in a cold environment and both can trigger the virus. govt should b aware that we can get infected to <U+2639><U+FE0F> bcoz only govt employees r being assess and not us "
"788","We fight as one. "
"789","what is so difficult abt following community quarantine guidelines and the implemented curfew at night when it would literally just help all of us to avoid becoming carriers of the virus ?? "
"790","Because of what happened here in CDO, the medical professionals exposed to the first case "
"791","Quarantine in entire M. Manila announced last Mar 12 and take effect on Mar 15. It should be unannounce or immediately take effect. Why? To contain covid-19 virus in entire M. Manila not to transfer to other province. But now people rush to escape M. Manila. <U+0001F62D> "
"792","Nothing in life is to be feared, it is only to be understood. Now is the time to understand more, so that we may fear less.

- Marie Curie

"
"793","Three o'clock is always too late or too early for anything you want to do.

Jean-Paul Sartre

"
"794","""Sometimes life hits you in the head with a brick. Don't lose faith."" - Steve Jobs

"
"795","What is social distancing?

Social distancing is the strict maintenance of a distance of at least one (1) meter radius between and among individuals. "
"796","I cant stress this enough; with the rapid increase of mortality in PH, we must take "
"797","“Eventually, everyone will be quarantined to their houses with no sports to watch.. and in 9 months from now a boom of babies will be born .. and we will call them the coronials” 

"
"798","Numbers of Corona Virus cases in the Philippines is rising. Let's all pray for protection and let's also declare that this pandemic will stop now in Jesus' name! 
Corona Virus, you are no match for our God!
"
"799","Las Piñas City is now on STATE OF CALAMITY. <U+2639><U+FE0F><U+0001F494>
"
"800","Ncov19 will no longer threaten us soon..."
"801","Its alarming. "
"802","I think it's always easy for anyone to point out the flaws of our government towards their actions to prevent the COVID-19, but what we should be doing now amidst this crisis is to do whatever we can to not get ourselves infected, unite and help each other.

"
"803","ANG DAMING BOBO RITO SA TWITTER JUST GO BACK TO FACEBOOK AND BE WITH THE OTHER UNCULTURED SWINE THERE  "
"804","God help this country and this government. "
"805","I never scared neither fear though i feel discriminated as subject for infection because if i do the same thing like others do who am i judge. "
"806","Whatever the President does, there are always those people who keep on complaining and keeping their eye on the shortcomings of the government. Instead of doing these things, which could worsen the situation, why can't you stay at home, obey the rules and pray?
"
"807","Why would the MMDA General Manager share fake news? 

What a trainwreck of a government
"
"808","What if some/most of the people who rant about the government actually acquire the disease and then seeks for their help. "
"809","How deadly Covid19 is? There were like 85% possibility that a person would die because there's no cure yet. It's for the patient to survive while suffering with that disease. Therefore let's prevent this by following precautionary measures. "
"810","At the end of the day, I can finally say that I contributed more than I criticized <U+0001F642>

"
"811","i am not pro or anti duterte but isn't so funny how everyone is just demanding and pa know-it-all, blaming it all to duterte like heck it's not like he developed the virus and want all of this to happen??? it's not always the government "
"812","y'all everyone stay safe!!! i am silently panicking and terrified but i know we'll get through this, together. stop spreading hate and fake news, for once. shut up if it's not gonna help. "
"813","I hate how the media always count the TOTAL number of confirmed cases but never the number of ACTIVE cases. The rise in total number causes more fear. I get my daily updates on stats from "
"814","How scary this dreadful disease "
"815","I’ll just leave it here.
"
"816","Turn anxiety into action. Support the health workers at the frontlines of the "
"817","What about all of the schools that are not yet suspending the classes? Do we really need to have cases first, so there will be a suspension?
"
"818","98 confirmed cases and you still think that this virus is not a serious matter and we shouldn't be scared of? Insensitive and out of your mind?? "
"819","You know what? Social media makes everyone panic. This makes the situation worse. There are also some people that have the audacity to spread fake news without knowing that this has a really big impact for everyone. Shame!
"
"820","If you really want change and an outcome, simulan mo sa sarili mo. Hindi ung magrereklamo ka sa ibang tao, sarili mo ba, nagreklamo ka?? If you'll blame others for the situation now, i think you should blame yourself too. "
"821","Whatever the President does, there are always those people who keep on complaining and keeping their eye on the shortcomings of the government. Instead of doing these things, which could worsen the situation, why can't you stay at home, obey the rules and pray?
"
"822","<U+203C><U+FE0F>don’t forget to wear your masks<U+203C><U+FE0F> Hehe

"
"823","EVERYTHING THAT'S HAPPENING FEELS SO UNREAL cant believe nangyayari to on my lifetime

"
"824","Wash your hands.
Avoid crowds.
Practice social distancing.
Keep your immune system up.
Keep updated.
Don't hoard on stuff.
Don't panic.
Stop spreading fake news.
Pray and trust God that everything will be okay.

Stay safe everyone! 
"
"825","Stop acting like little kids who always throws tantrum be happy that the government is doing their best to prevent us from having such terrible disease <U+203C><U+FE0F> "
"826","No mass, malls will be closed, no social gatherings, no teleseryes, no work and school, travel ban and curfews will be imposed. What a sad year. <U+0001F61E>I just pray that everything will end soon. That everything will go back to normal. <U+0001F64F>

"
"827","I felt sad for this man. His visa will expire after 14 days from yesterday<U+0001F625>and he is affected with this travel ban (to-from Manila) worst is he can only return to Singapore if he will depart from Manila<U+0001F494> 

"
"828","In the midst of crisis Filipinos should stand together and help each other instead of using Social Media to bash one another.
"
"829","98 cases na.. This is very very alarming. Intense control and containment should be implemented! "
"830","Let us stop blaming the gov sa lahat ng nangyayari when we can't even discipline ourselves by simply following their orders. "
"831","other countries: government declares lockdown, citizens follow.

Philippines:
"
"832","Some false information spreading online regarding "
"833","What if some of those persons who runs out in the Metro Manila just to avoid the Community Quarantine are already exposed to the Covid-19?  "
"834","The rich are hoarding
The middle class are panic buying
The poor are hoping to be spared from the virus. <U+0001F641>

"
"835","This virus is more than the statistics. It took lives and still taking even up to this minute. Godspeed <U+0001F64F> "
"836","our chaka president found the perfect excuse to enforce martial law talaga without directly saying it no? even going as far as placing curfew and arresting peoole as if may pinipiling oras yung virus "
"837","It seems like people been fighting with people who critize the government in this time of crisis and are suggesting to just hold hand with the government in hope of defeating the current issue but i must differ becoz even if we all hold hands together ++ "
"838","Without the right plan, those actions will be nothing but mediocre resolve   and this is what i fear the time where we wont be able to hold hands just because the things there doing now are wrong however at the same time i cannot judge , i am in no position too ++ "
"839","Stop CONDEMNING them.            Start PRAYING for them <U+0001F64F>"
"840","Peeps in social media is straight-up ranting about the government and esp. du30. du30 doesnt want us to panic and yet people panic. use ur brains peeps, instead of ranting to du30, try to reflect your actions to everyone. du30 is still human, he is carrying the burden
"
"841","We need this one now. 
We're all in stress.
I cried watching this &amp; it's ok. 
Let's beat this virus. 
"
"842","Philippines is up to 64.
Pls also PRAY HARD for us <U+0001F64F>
"
"843","Daming pa-woke sa Twitter. Daming say pero ang TOTOXIC naman. gH0rL, just so u know you are not helping. Nagcacause ka lang ng panic. Don't politicize everything. Why don't u follow the rules wala namang mawawala. Shut the fuck up if u have nothing nice to say. <U+0001F910>

"
"844","I was sad when my sister told me that her friend who is a doctor here in Manila called her at midnight telling her that he is so tired and exhausted due to volume of patients in the hospital. Let's not forget to pray for our health workers <U+0001F64F><U+0001F64F><U+0001F64F> "
